titulo,url,tipo_clasificado,body_text,body_length,transcript_text,transcript_length,transcript_source,combined_text,combined_length,estado_extraccion,notas
La villa en Lombok que parecía una gran inversión… hasta que apareció Hacienda,https://fiscalizarte.substack.com/p/la-villa-en-lombok-que-parecia-una,texto_normal,"Ayer tuve una sesión de mentorización con un miembro de Fiscalizarte Premium.
Una hora analizando su situación actual, su estrategia de inversión, su patrimonio, su fiscalidad y, sobre todo, los objetivos que debería marcarse para invertir mejor.
Invertir mejor no significa comprar más.
Significa comprar con cabeza.
Y con fiscalidad.
Porque a veces la inversión no te la destroza el mercado.
Te la destroza no haber preguntado antes lo que había que preguntar.
Este miembro de la comunidad me ha dado permiso para contar su historia.
No para señalarle.
Sino para que tú no cometas el mismo error.
Porque esto que le ha pasado a él y a su pareja le puede pasar mañana a cualquier inversor que se deje seducir por una rentabilidad bonita, una playa exótica y una presentación comercial bien montada.
La historia empieza así.
A él y a su pareja les ofrecieron invertir en Lombok.
Comprar una villa.
Explotarla como alquiler vacacional.
Todo muy bonito.
Todo muy llave en mano.
Todo muy “tú no te preocupes, nosotros nos encargamos”.
Ya sabes.
La frase favorita de quien quiere que firmes antes de que entiendas.
La empresa que les ofrecía la inversión les hablaba de montar una sociedad allí, abrir una cuenta bancaria en el extranjero y utilizar esa estructura para gestionar la inversión.
Y por lo que me cuenta, también les insinuaban fórmulas para que esos ingresos no estuvieran demasiado fiscalizados en España.
Traducido:
“Vamos a hacer una estructura medio rara para que Hacienda no mire mucho”.
Y aquí viene el problema.
Ellos son residentes fiscales en España.
Y si eres residente fiscal en España, tributas en España por tu renta mundial.
No por la renta que te apetece declarar.
No por la renta que entra en una cuenta española.
No por la renta que se genera a menos de 500 kilómetros de tu casa.
Por tu renta mundial.
También por una villa en Lombok.
También por los ingresos de alquiler vacacional que te genere.
También aunque la cuenta esté fuera.
También aunque la empresa gestora te haya vendido otra película.
Al final, esta pareja compró como persona física.
Y ahora tienen un inmueble a miles de kilómetros que les genera una rentabilidad bruta aproximada del 10%-12% antes de impuestos.
Sobre el papel, suena bien.
Hasta que lo fiscalizas.
Porque esos ingresos, siendo personas físicas residentes fiscales en España, acaban tributando en la base general del IRPF.
Y da la casualidad de que ambos tienen marginales altos.
Resultado:
Lo que parecía una inversión del 10%-12% empieza a quedarse en una rentabilidad neta que probablemente no llega ni al 6%.
Y entonces la foto cambia.
Porque ya no tienes una inversión exótica con alta rentabilidad.
Tienes dinero inmovilizado a miles de kilómetros.
Tienes dependencia de una empresa gestora.
Tienes promesas comerciales que no siempre se cumplen.
Tienes fiscalidad española.
Tienes riesgo jurídico internacional.
Tienes dificultad de control.
Y tienes una rentabilidad neta que, siendo sinceros, quizá no compensa el lío.
Esto es lo que muchos vendedores de inversiones no te cuentan.
Porque si te lo contaran antes, igual no firmabas.
Te enseñan la villa.
Te enseñan la piscina.
Te enseñan la ocupación prevista.
Te enseñan la rentabilidad bruta.
Te enseñan la foto del paraíso.
Pero no te enseñan la declaración de la renta.
No te enseñan el marginal.
No te enseñan el impacto real después de impuestos.
No te enseñan qué pasa si la sociedad extranjera está mal planteada.
No te enseñan qué pasa si Hacienda española pregunta.
No te enseñan qué pasa si un día quieres vender.
No te enseñan nada de lo que realmente importa cuando inviertes patrimonio que te ha costado años ahorrar.
Porque el negocio de muchos no es que tú ganes dinero.
El negocio de muchos es colocarte la operación.
Y luego ya veremos.
Esto no va de Lombok.
Va de una idea mucho más importante:
No puedes analizar una inversión inmobiliaria sin analizar antes su fiscalidad.
Da igual que sea en Madrid.
Da igual que sea en Valencia.
Da igual que sea en Lombok.
Da igual que sea una vivienda para alquilar.
Da igual que sea un NPL.
Da igual que sea una villa vacacional.
Si no sabes cómo tributa, no sabes cuánto ganas.
Y si no sabes cuánto ganas, no estás invirtiendo.
Estás comprando una esperanza.
Y las esperanzas no pagan facturas.
Por eso insisto tanto en Fiscalizarte con lo mismo.
Antes de entrar en una operación, tienes que saber:
Cómo se estructura.
Quién compra.
Dónde se declara.
Qué impuestos soportas.
Qué rentabilidad queda después de impuestos.
Qué riesgos fiscales tienes.
Qué pasa si vendes.
Qué pasa si cobras en el extranjero.
Qué pasa si Hacienda pregunta.
Porque el problema no es pagar impuestos.
El problema es invertir pensando que vas a ganar un 12% y descubrir después que, una vez pasa Hacienda, la gestora, los costes y la realidad, te queda una rentabilidad mediocre con un riesgo mucho más alto del que imaginabas.
Y sí, sé que esto no es tan sexy como vender villas en Indonesia.
Pero es bastante más útil.
Fiscalizarte Premium existe precisamente para esto.
Para que antes de meter tu dinero en una operación, tengas criterio.
Para que no dependas de lo que te cuente el comercial de turno.
Para que no te comas estructuras fiscales con patas cortas.
Para que puedas analizar inversiones inmobiliarias con una mirada completa: rentabilidad, riesgo, fiscalidad y estrategia patrimonial.
Dentro de Fiscalizarte Premium tienes acceso al contenido fiscal, a la Escuela de Inversión Inmobiliaria, a casos reales, a clases prácticas y a un grupo privado de Telegram con más de 190 inversores donde compartimos experiencias, operaciones, dudas y aprendizajes.
Y ahora mismo hay activo un descuento del 20% en la cuota anual.
Puedes entrar por apenas 120 euros al año.
Que es bastante menos de lo que te puede costar una mala decisión fiscal.
Luego cada uno decide.
Puedes seguir invirtiendo por tu cuenta, fiándote de quien te vende la operación y rezando para que la fiscalidad encaje después.
O puedes empezar a invertir con más criterio.
Con más control.
Y con menos cuentos.
Te dejo el enlace aquí debajo para entrar en Fiscalizarte Premium.
Descuento del 30% para acceder a Fiscalizarte Premium.
Compartir Fiscalizarte - La Newsletter sobre Fiscalidad Inmobiliaria",6235,,0,none,"Ayer tuve una sesión de mentorización con un miembro de Fiscalizarte Premium.
Una hora analizando su situación actual, su estrategia de inversión, su patrimonio, su fiscalidad y, sobre todo, los objetivos que debería marcarse para invertir mejor.
Invertir mejor no significa comprar más.
Significa comprar con cabeza.
Y con fiscalidad.
Porque a veces la inversión no te la destroza el mercado.
Te la destroza no haber preguntado antes lo que había que preguntar.
Este miembro de la comunidad me ha dado permiso para contar su historia.
No para señalarle.
Sino para que tú no cometas el mismo error.
Porque esto que le ha pasado a él y a su pareja le puede pasar mañana a cualquier inversor que se deje seducir por una rentabilidad bonita, una playa exótica y una presentación comercial bien montada.
La historia empieza así.
A él y a su pareja les ofrecieron invertir en Lombok.
Comprar una villa.
Explotarla como alquiler vacacional.
Todo muy bonito.
Todo muy llave en mano.
Todo muy “tú no te preocupes, nosotros nos encargamos”.
Ya sabes.
La frase favorita de quien quiere que firmes antes de que entiendas.
La empresa que les ofrecía la inversión les hablaba de montar una sociedad allí, abrir una cuenta bancaria en el extranjero y utilizar esa estructura para gestionar la inversión.
Y por lo que me cuenta, también les insinuaban fórmulas para que esos ingresos no estuvieran demasiado fiscalizados en España.
Traducido:
“Vamos a hacer una estructura medio rara para que Hacienda no mire mucho”.
Y aquí viene el problema.
Ellos son residentes fiscales en España.
Y si eres residente fiscal en España, tributas en España por tu renta mundial.
No por la renta que te apetece declarar.
No por la renta que entra en una cuenta española.
No por la renta que se genera a menos de 500 kilómetros de tu casa.
Por tu renta mundial.
También por una villa en Lombok.
También por los ingresos de alquiler vacacional que te genere.
También aunque la cuenta esté fuera.
También aunque la empresa gestora te haya vendido otra película.
Al final, esta pareja compró como persona física.
Y ahora tienen un inmueble a miles de kilómetros que les genera una rentabilidad bruta aproximada del 10%-12% antes de impuestos.
Sobre el papel, suena bien.
Hasta que lo fiscalizas.
Porque esos ingresos, siendo personas físicas residentes fiscales en España, acaban tributando en la base general del IRPF.
Y da la casualidad de que ambos tienen marginales altos.
Resultado:
Lo que parecía una inversión del 10%-12% empieza a quedarse en una rentabilidad neta que probablemente no llega ni al 6%.
Y entonces la foto cambia.
Porque ya no tienes una inversión exótica con alta rentabilidad.
Tienes dinero inmovilizado a miles de kilómetros.
Tienes dependencia de una empresa gestora.
Tienes promesas comerciales que no siempre se cumplen.
Tienes fiscalidad española.
Tienes riesgo jurídico internacional.
Tienes dificultad de control.
Y tienes una rentabilidad neta que, siendo sinceros, quizá no compensa el lío.
Esto es lo que muchos vendedores de inversiones no te cuentan.
Porque si te lo contaran antes, igual no firmabas.
Te enseñan la villa.
Te enseñan la piscina.
Te enseñan la ocupación prevista.
Te enseñan la rentabilidad bruta.
Te enseñan la foto del paraíso.
Pero no te enseñan la declaración de la renta.
No te enseñan el marginal.
No te enseñan el impacto real después de impuestos.
No te enseñan qué pasa si la sociedad extranjera está mal planteada.
No te enseñan qué pasa si Hacienda española pregunta.
No te enseñan qué pasa si un día quieres vender.
No te enseñan nada de lo que realmente importa cuando inviertes patrimonio que te ha costado años ahorrar.
Porque el negocio de muchos no es que tú ganes dinero.
El negocio de muchos es colocarte la operación.
Y luego ya veremos.
Esto no va de Lombok.
Va de una idea mucho más importante:
No puedes analizar una inversión inmobiliaria sin analizar antes su fiscalidad.
Da igual que sea en Madrid.
Da igual que sea en Valencia.
Da igual que sea en Lombok.
Da igual que sea una vivienda para alquilar.
Da igual que sea un NPL.
Da igual que sea una villa vacacional.
Si no sabes cómo tributa, no sabes cuánto ganas.
Y si no sabes cuánto ganas, no estás invirtiendo.
Estás comprando una esperanza.
Y las esperanzas no pagan facturas.
Por eso insisto tanto en Fiscalizarte con lo mismo.
Antes de entrar en una operación, tienes que saber:
Cómo se estructura.
Quién compra.
Dónde se declara.
Qué impuestos soportas.
Qué rentabilidad queda después de impuestos.
Qué riesgos fiscales tienes.
Qué pasa si vendes.
Qué pasa si cobras en el extranjero.
Qué pasa si Hacienda pregunta.
Porque el problema no es pagar impuestos.
El problema es invertir pensando que vas a ganar un 12% y descubrir después que, una vez pasa Hacienda, la gestora, los costes y la realidad, te queda una rentabilidad mediocre con un riesgo mucho más alto del que imaginabas.
Y sí, sé que esto no es tan sexy como vender villas en Indonesia.
Pero es bastante más útil.
Fiscalizarte Premium existe precisamente para esto.
Para que antes de meter tu dinero en una operación, tengas criterio.
Para que no dependas de lo que te cuente el comercial de turno.
Para que no te comas estructuras fiscales con patas cortas.
Para que puedas analizar inversiones inmobiliarias con una mirada completa: rentabilidad, riesgo, fiscalidad y estrategia patrimonial.
Dentro de Fiscalizarte Premium tienes acceso al contenido fiscal, a la Escuela de Inversión Inmobiliaria, a casos reales, a clases prácticas y a un grupo privado de Telegram con más de 190 inversores donde compartimos experiencias, operaciones, dudas y aprendizajes.
Y ahora mismo hay activo un descuento del 20% en la cuota anual.
Puedes entrar por apenas 120 euros al año.
Que es bastante menos de lo que te puede costar una mala decisión fiscal.
Luego cada uno decide.
Puedes seguir invirtiendo por tu cuenta, fiándote de quien te vende la operación y rezando para que la fiscalidad encaje después.
O puedes empezar a invertir con más criterio.
Con más control.
Y con menos cuentos.
Te dejo el enlace aquí debajo para entrar en Fiscalizarte Premium.
Descuento del 30% para acceder a Fiscalizarte Premium.
Compartir Fiscalizarte - La Newsletter sobre Fiscalidad Inmobiliaria",6235,OK,
El error fiscal que veo en el 95% de inversores inmobiliarios.,https://fiscalizarte.substack.com/p/el-error-fiscal-que-veo-en-el-95,texto_normal,"Hay una realidad que me encuentro casi siempre cuando mentorizo a inversores inmobiliarios.
Vienen con una idea muy clara:
“Quiero pagar menos impuestos”.
Perfecto.
Pero cuando analizo su situación fiscal y patrimonial con documentación real —IRPF presentado, inmuebles, rentas, estructura, números— aparece siempre el mismo problema.
Han construido todo su patrimonio sobre una sola pata:
comprar pisos para alquilar.
Y sí, eso puede estar bien.
Pero fiscalmente tiene una trampa enorme.
Porque muchos de estos inversores tienen además:
salario medio o alto;
actividad económica como autónomos;
alquileres como persona física.
¿Y dónde acaba todo eso?
En la
base general del IRPF
.
Es decir:
Tu nómina.
Tus ingresos como autónomo.
Tus alquileres.
Todo se suma.
Y dependiendo de la comunidad autónoma donde vivas, puedes acabar llegando a tramos del 50%, 52% o incluso más.
Así que tú crees que estás construyendo libertad financiera.
Pero en realidad estás construyendo una máquina de generar ingresos para Hacienda.
No suena tan bonito, pero es lo que hay.
El problema no es comprar pisos.
El problema es comprar pisos sin mirar la fiscalidad.
Porque si alquilas como vivienda habitual, puedes aplicar reducciones del 50%, 60%, 70% o incluso 90% en determinados casos.
Ahí la fiscalidad ayuda.
Pero muchos inversores no compran ese tipo de activos.
Compran habitaciones.
Compran vacacional.
Compran locales.
Compran activos donde esa reducción no aplica.
Y aun así no exigen más rentabilidad.
Ese es el fallo.
Si un inmueble tributa peor, tiene que darte algo a cambio.
Más rentabilidad.
Más seguridad.
Más liquidez.
Menos gestión.
Pero comprar peor fiscalmente y conformarte con una rentabilidad mediocre no es invertir.
Es hacerte trampas en el Excel.
Y aquí viene lo importante.
Cuando reviso declaraciones de inversores inmobiliarios, hay una casilla que casi siempre está vacía:
la base del ahorro.
Vacía.
Muerta.
Abandonada.
Como mucho, aparece algún interés ridículo de una cuenta remunerada.
Y ya.
Mientras tanto, toda la estrategia del inversor está concentrada en generar rentas que van a la base general.
Ese es el gran error.
Porque los
rendimientos del capital mobiliario
tributan en la base del ahorro.
Y la base del ahorro tributa del 19% al 30%.
Da igual que vivas en Madrid, Cataluña, Andalucía o Valencia.
No depende de tu comunidad autónoma.
Ejemplo sencillo.
Si generas 50.000 euros de rendimientos del capital mobiliario en un año, la tributación efectiva aproximada estaría en torno al 20%-21%.
Ahora compara eso con generar esos mismos 50.000 euros en la base general.
Ahí puedes estar pagando bastante más.
En muchos casos, 8, 9 o 10 puntos porcentuales adicionales.
Y esos puntos no son teoría.
Son dinero que no reinviertes.
Son años de crecimiento que pierdes.
Son patrimonio que se queda por el camino.
Entonces aparece la objeción típica:
“Ya, pero los pisos me dan rentas mensuales”.
Vale.
Pero eso no significa que sean siempre la mejor opción.
Un préstamo participativo, una cuenta en participación o determinadas operaciones de coinversión inmobiliaria pueden generarte rendimientos del capital mobiliario.
Y aunque no siempre cobres como un alquiler mensual, puedes obtener un retorno anual mucho más alto.
Un buen alquiler hoy puede darte un 7%, 8%, 10% o 12% si eres muy bueno comprando.
La inversión inmobiliaria tradicional en España muchas veces ni llega al 4% real.
Pero en determinadas operaciones de coinversión inmobiliaria puedes encontrar retornos del 15%, 20% o incluso 25% anual sobre el capital invertido.
Con riesgo, claro.
Como todo.
También tiene riesgo un inquilino que no paga.
También tiene riesgo una reforma que se dispara.
También tiene riesgo comprar en una zona donde luego no entra nadie solvente.
La diferencia es que en ciertas coinversiones puedes tener:
más rentabilidad,
menos gestión,
activos reales detrás,
y una fiscalidad mucho más eficiente.
Esta es la estrategia que yo llevo aplicando desde hace unos dos años.
Y cada vez lo tengo más claro:
Comprar para alquilar está pasando a un segundo plano para mí.
¿Por qué?
Porque los precios han subido mucho.
Porque cada vez hay menos producto bueno.
Porque el producto que da rentabilidad muchas veces viene con más problemas: zonas peores, inmuebles deteriorados, inquilinos más delicados y más dolores de cabeza.
Y yo no invierto solo para presumir de rentabilidad.
Invierto para hacer crecer mi patrimonio y dormir tranquilo.
Por eso cada vez me interesan más las operaciones de coinversión inmobiliaria bien analizadas.
Operaciones con inversores que conozco.
Operaciones que puedo tocar.
Operaciones que puedo visitar.
Operaciones con inmuebles reales detrás.
Operaciones donde entiendo el riesgo.
Y operaciones que pueden darme un 20%-25% anual.
Pero lo importante no es solo la rentabilidad.
Lo importante es que fiscalmente esos rendimientos pueden ir a la base del ahorro.
Y eso cambia mucho la película.
No te estoy diciendo que vendas tus pisos.
No te estoy diciendo que dejes de alquilar.
No te estoy diciendo que metas dinero en cualquier operación que prometa un 20%.
Te estoy diciendo algo más incómodo:
puede que tu estrategia como inversor esté incompleta.
Puede que estés comprando más inmuebles, pero creciendo más lento de lo que podrías.
Puede que estés obsesionado con el cash flow, pero ignorando la fiscalidad.
Puede que estés pagando más impuestos de los necesarios porque toda tu estrategia está metida en la base general del IRPF.
Y puede que tu patrimonio no necesite otro piso.
Puede que necesite mejor estructura.
Fiscalizarte Premium existe precisamente para esto.
Para que entiendas cómo tributan tus inversiones.
Para que aprendas a mirar más allá del alquiler.
Para que dejes de tomar decisiones inmobiliarias como si Hacienda no existiera.
Y para que construyas una estrategia patrimonial más inteligente.
Dentro ya somos más de
180 inversores inmobiliarios
aprendiendo fiscalidad, analizando casos reales, compartiendo dudas y haciendo networking.
No teoría vacía.
Casos reales.
Números reales.
Impuestos reales.
Errores reales.
Decisiones reales.
Ahora puedes entrar con un
30% de descuento en la cuota anual
.
Me interesa que estés dentro al menos un año.
Porque en un año puedes cambiar por completo la forma en la que inviertes.
Y cuando entiendes la fiscalidad, empiezas a ver oportunidades que antes ni siquiera sabías que existían.
Aquí tienes el descuento del 30% para entrar en Fiscalizarte Premium:
[ENLACE]
Nos vemos dentro.
Un saludo,
Manu,
Fiscalizarte.
Compartir Fiscalizarte - La Newsletter sobre Fiscalidad Inmobiliaria",6589,,0,none,"Hay una realidad que me encuentro casi siempre cuando mentorizo a inversores inmobiliarios.
Vienen con una idea muy clara:
“Quiero pagar menos impuestos”.
Perfecto.
Pero cuando analizo su situación fiscal y patrimonial con documentación real —IRPF presentado, inmuebles, rentas, estructura, números— aparece siempre el mismo problema.
Han construido todo su patrimonio sobre una sola pata:
comprar pisos para alquilar.
Y sí, eso puede estar bien.
Pero fiscalmente tiene una trampa enorme.
Porque muchos de estos inversores tienen además:
salario medio o alto;
actividad económica como autónomos;
alquileres como persona física.
¿Y dónde acaba todo eso?
En la
base general del IRPF
.
Es decir:
Tu nómina.
Tus ingresos como autónomo.
Tus alquileres.
Todo se suma.
Y dependiendo de la comunidad autónoma donde vivas, puedes acabar llegando a tramos del 50%, 52% o incluso más.
Así que tú crees que estás construyendo libertad financiera.
Pero en realidad estás construyendo una máquina de generar ingresos para Hacienda.
No suena tan bonito, pero es lo que hay.
El problema no es comprar pisos.
El problema es comprar pisos sin mirar la fiscalidad.
Porque si alquilas como vivienda habitual, puedes aplicar reducciones del 50%, 60%, 70% o incluso 90% en determinados casos.
Ahí la fiscalidad ayuda.
Pero muchos inversores no compran ese tipo de activos.
Compran habitaciones.
Compran vacacional.
Compran locales.
Compran activos donde esa reducción no aplica.
Y aun así no exigen más rentabilidad.
Ese es el fallo.
Si un inmueble tributa peor, tiene que darte algo a cambio.
Más rentabilidad.
Más seguridad.
Más liquidez.
Menos gestión.
Pero comprar peor fiscalmente y conformarte con una rentabilidad mediocre no es invertir.
Es hacerte trampas en el Excel.
Y aquí viene lo importante.
Cuando reviso declaraciones de inversores inmobiliarios, hay una casilla que casi siempre está vacía:
la base del ahorro.
Vacía.
Muerta.
Abandonada.
Como mucho, aparece algún interés ridículo de una cuenta remunerada.
Y ya.
Mientras tanto, toda la estrategia del inversor está concentrada en generar rentas que van a la base general.
Ese es el gran error.
Porque los
rendimientos del capital mobiliario
tributan en la base del ahorro.
Y la base del ahorro tributa del 19% al 30%.
Da igual que vivas en Madrid, Cataluña, Andalucía o Valencia.
No depende de tu comunidad autónoma.
Ejemplo sencillo.
Si generas 50.000 euros de rendimientos del capital mobiliario en un año, la tributación efectiva aproximada estaría en torno al 20%-21%.
Ahora compara eso con generar esos mismos 50.000 euros en la base general.
Ahí puedes estar pagando bastante más.
En muchos casos, 8, 9 o 10 puntos porcentuales adicionales.
Y esos puntos no son teoría.
Son dinero que no reinviertes.
Son años de crecimiento que pierdes.
Son patrimonio que se queda por el camino.
Entonces aparece la objeción típica:
“Ya, pero los pisos me dan rentas mensuales”.
Vale.
Pero eso no significa que sean siempre la mejor opción.
Un préstamo participativo, una cuenta en participación o determinadas operaciones de coinversión inmobiliaria pueden generarte rendimientos del capital mobiliario.
Y aunque no siempre cobres como un alquiler mensual, puedes obtener un retorno anual mucho más alto.
Un buen alquiler hoy puede darte un 7%, 8%, 10% o 12% si eres muy bueno comprando.
La inversión inmobiliaria tradicional en España muchas veces ni llega al 4% real.
Pero en determinadas operaciones de coinversión inmobiliaria puedes encontrar retornos del 15%, 20% o incluso 25% anual sobre el capital invertido.
Con riesgo, claro.
Como todo.
También tiene riesgo un inquilino que no paga.
También tiene riesgo una reforma que se dispara.
También tiene riesgo comprar en una zona donde luego no entra nadie solvente.
La diferencia es que en ciertas coinversiones puedes tener:
más rentabilidad,
menos gestión,
activos reales detrás,
y una fiscalidad mucho más eficiente.
Esta es la estrategia que yo llevo aplicando desde hace unos dos años.
Y cada vez lo tengo más claro:
Comprar para alquilar está pasando a un segundo plano para mí.
¿Por qué?
Porque los precios han subido mucho.
Porque cada vez hay menos producto bueno.
Porque el producto que da rentabilidad muchas veces viene con más problemas: zonas peores, inmuebles deteriorados, inquilinos más delicados y más dolores de cabeza.
Y yo no invierto solo para presumir de rentabilidad.
Invierto para hacer crecer mi patrimonio y dormir tranquilo.
Por eso cada vez me interesan más las operaciones de coinversión inmobiliaria bien analizadas.
Operaciones con inversores que conozco.
Operaciones que puedo tocar.
Operaciones que puedo visitar.
Operaciones con inmuebles reales detrás.
Operaciones donde entiendo el riesgo.
Y operaciones que pueden darme un 20%-25% anual.
Pero lo importante no es solo la rentabilidad.
Lo importante es que fiscalmente esos rendimientos pueden ir a la base del ahorro.
Y eso cambia mucho la película.
No te estoy diciendo que vendas tus pisos.
No te estoy diciendo que dejes de alquilar.
No te estoy diciendo que metas dinero en cualquier operación que prometa un 20%.
Te estoy diciendo algo más incómodo:
puede que tu estrategia como inversor esté incompleta.
Puede que estés comprando más inmuebles, pero creciendo más lento de lo que podrías.
Puede que estés obsesionado con el cash flow, pero ignorando la fiscalidad.
Puede que estés pagando más impuestos de los necesarios porque toda tu estrategia está metida en la base general del IRPF.
Y puede que tu patrimonio no necesite otro piso.
Puede que necesite mejor estructura.
Fiscalizarte Premium existe precisamente para esto.
Para que entiendas cómo tributan tus inversiones.
Para que aprendas a mirar más allá del alquiler.
Para que dejes de tomar decisiones inmobiliarias como si Hacienda no existiera.
Y para que construyas una estrategia patrimonial más inteligente.
Dentro ya somos más de
180 inversores inmobiliarios
